{
  "$schema": "../../../schema/component.schema.json",
  "schemaVersion": 1,
  "id": "file-upload",
  "name": "File upload",
  "category": "component",
  "status": "stable",
  "summary": "Use file upload when users must select and submit one or more files from their device.",
  "source": {
    "guidanceUrl": "https://design-system.service.gov.uk/components/file-upload/",
    "implementationUrl": "https://github.com/alphagov/govuk-frontend/tree/v6.5.0/packages/govuk-frontend/src/govuk/components/file-upload",
    "govukFrontendVersion": "6.5.0",
    "reviewedAt": "2026-09-09"
  },
  "whenToUse": [
    "Use only when a file is necessary and the service cannot obtain the information another way.",
    "Explain accepted formats, size limits and whether multiple files are allowed before the control."
  ],
  "whenNotToUse": [
    "Do not ask for a file when users can provide a short answer directly in the service.",
    "Do not rely on the accept attribute or client-side checks as authoritative validation."
  ],
  "anatomy": [
    {
      "name": "Form group",
      "required": true,
      "description": "Groups the visible label, optional hint, optional error and file input."
    },
    {
      "name": "Label",
      "required": true,
      "description": "A label associated by for and id tells users what to upload."
    },
    {
      "name": "Native file input",
      "required": true,
      "description": "An input type=file keeps browser and assistive-technology selection behaviour."
    }
  ],
  "variants": [
    {
      "id": "default",
      "name": "Single file",
      "element": "input",
      "classes": ["govuk-file-upload"],
      "use": "Upload one required file."
    },
    {
      "id": "error",
      "name": "Error",
      "element": "input",
      "classes": ["govuk-file-upload", "govuk-file-upload--error"],
      "use": "Redisplay after a missing, invalid or failed upload with a linked error message."
    }
  ],
  "behaviour": [
    "Submit using a form encoding that supports files and validate the received file on the server.",
    "Handle missing, oversized, unsupported and malicious files safely and explain recoverable errors.",
    "The base file input does not require GOV.UK JavaScript."
  ],
  "accessibility": [
    "Keep the native input and an associated visible label.",
    "Reference hint and error IDs with aria-describedby in that order.",
    "Do not make drag-and-drop the only way to select a file."
  ],
  "content": [
    "Name the document or evidence required rather than using only “Upload a file”.",
    "State accepted formats, maximum size and how to provide an alternative.",
    "Error messages must say whether the user needs a different file, format or size."
  ],
  "tokenRefs": [
    "govuk.color.input-border",
    "govuk.color.error",
    "govuk.color.focus",
    "govuk.color.focus-text"
  ],
  "htmlExamples": [
    {
      "name": "Single supporting document",
      "html": "<div class=\"govuk-form-group\">\n  <label class=\"govuk-label\" for=\"evidence\">Upload your supporting evidence</label>\n  <div id=\"evidence-hint\" class=\"govuk-hint\">The file must be a PDF, JPG or PNG smaller than 10MB.</div>\n  <input class=\"govuk-file-upload\" id=\"evidence\" name=\"evidence\" type=\"file\" aria-describedby=\"evidence-hint\">\n</div>"
    }
  ]
}
